id,title,category,new_query,user_id,remaining_interaction_string,classification,preferences,target_count,targets,similarity_score,price,ranking,query
B007TZXVDW,ECCO Men's Biom Train Mesh Cross Trainer,Comfort Shoes | Shoes | Athletic | E | Running | ECCO | Men,Can you help me choose a set of clothes for men that provide support for larger body types during long outdoor excursions?,A3QIFCVVEBNW82,B00B4A1TA0|B000MN87D2|B007VSUL80|B004LKZI3O|B0009MZWC0,1,"The user shows a strong interest in active and sports-related clothing, suggesting a lifestyle that includes physical activities or sports.",-1,,0.56270015,,7309,Can you help me choose a men's athletic running shoes for long outdoor excursions that provide support for larger body types?
B008ATG0N4,"Bonnie Jean Girls 2-6X Glitter Knit Bodice Dress To Tiered Skirt, Gray, 5",Playwear | Clothing | Dresses | Girls | Special Occasion,Can you recommend me a girls' dress that works well for a celebration? I'm not sure about the specific wearing scene.,AQLNRL6NUUXQW,B004BKIPHK|B002N5MKY4|B002Z7F12I,3,"The user has a preference for performance and recovery-oriented products, as seen in their purchase of compression socks.",-1,,-10.194823,,598142,Can you recommend me a girls' dress that works best for a family gathering and a milestone celebration?
B00FNN8OU2,Ocean Avenue Women's Ruffle Skirted,Bikinis | Women | Swimsuits & Cover Ups | Clothing,I'm interested in a skirt that can help me with sun protection during family gatherings by the pool.,AT7VTE9MSM4UE,B00CXLGIAK|B00825HNPA|B003JK3UGY|B000Z4KU42|B000F6UM9I,0,"The user has a specific interest in everyday bras and possibly enjoys supporting their favorite sports team, as indicated by the purchase of a Kansas City Royals cap.",1,skirt that can help with sun protection during family gatherings by the pool,-1.9198815,,4222,I'm interested in a skirt that can help me with sun protection during family gatherings and casual outings by the pool.
B008KKIVX0,Stride Rite SRT SM Lola Sneaker (Infant/Toddler),S | Girls | Stride Rite,Do you have any suggestions for girls' sneakers that are suitable for active play?,A3N4AVDKZU7RK5,B009X4YRCG|B0006MFKJS|B002KT2PJS|B0032IDPEU|B000DZUGOM,0,"The user shows a strong preference for the brand Clarks, indicating a possible brand loyalty.",1,girls' sneakers suitable for active play,-10.1968775,,4696,Do you have any suggestions for girls' sneakers that are suitable for active play and special occasions?
B00CPC9V1A,Robesale Women's Velour Cotton Terry Shawl Collar Bathrobe,"Women | Clothing | Sleep & Lounge | Lingerie, Sleep & Lounge | Robes",Can you recommend a women's robe that will work for my petite body shape?,A37MFA4W3MSCS5,B00C62G1G2|B0040H3WFE|B0006MFKJS|B0080ZEHHY,-1,"The user shows a preference for The SAK brand, particularly in handbags and wallets.",1,women's robe,-10.192837,,204377,Can you recommend a women's robe that will work for my petite body shape?
B00B6ZNHX0,Skechers Men's Relaxed Fit Memory Foam Superior-Tevin Oxford,Comfort Shoes | Shoes | S | Skechers | Men | Oxfords,"What’s the best men's shoes I can use for long days at the office? Additionally, recommend an additional pair of pants and socks to go with these shoes.",A2CN7PIZOBXJRM,B00EI3VS7Y|B0013UMQXU|B004F1YJRA|B0032AMW4W|B005D4Z36Y|B0013UMQX0,2,"The user shows a preference for clothing items that offer comfort and functionality, such as expandable waist pants and braided belts.",3,men's shoes for long days at the office|pair of pants|socks,-9.370158,,8033,What’s the best men's shoes I can use for long days at the office and casual outings?
B00A81MVY4,Ed Hardy Mens All Over Track Jacket,Track & Active Jackets | Track Jackets | Clothing | Ed Hardy | Active | E | Men | Sports & Outdoors,I'm looking for a men's track jacket that offers versatility for outdoor activities while making a bold fashion statement. I'm not sure about the specific wearing scene.,A24L497U2W19J5,B00A81ICZG|B009L2HUD8|B008UYC7EA|B008IDBI2K|B008SLDZNC,3,"The user shows a preference for trendy and branded fashion items, with a particular interest in Ed Hardy products.",-1,,-3.836601,39.99,847877,I’m looking for a men's track jacket that provides versatility for both casual outings and outdoor activities while reflecting a bold fashion statement.
B0078JGZH8,"Kamik Women's Celebrate Snow Boot,Black,9 M US",Women | Shoes | Snow & Cold Weather | K | Outdoor | Kamik | Outdoor & Work | Snow Boots | Boot Shop | Boots,What would you recommend for a women's snow boots that are suitable for outdoor shopping and layering for warmth during winter travel?,A2HFX5L67S3F32,B00AL10QB6|B0092OQIJC|B00B2MYSHG|B007O13OSI|B007PCSISW,4,The user shows a preference for winter-ready footwear and designer-inspired fashion items.,1,women's snow boots suitable for outdoor shopping and layering for warmth during winter travel,-10.196852,,91875,What would you recommend for a women's snow boots that are suitable for outdoor shopping and layering for warmth during winter travel?
B00E80CEKC,Spreadshirt Men's Templar Knight T-Shirt,"Shirts | Clothing | T-Shirts | Boys | Men | Novelty, Costumes & More | Novelty",Do you have any suggestions for a men's T-shirt with a fun travel theme?,A35CCGJDNXUDY9,B00ENXOM2M|B005ZX8TJG|B009ZW3CRC|B00835MOGM|B008L2UNGA|B0067O0JC2|B006XNF9W2|B0083ZD34O|B005CI99PW|B0030AH9VU|B003P4UT4A|B002ACIYDQ|B003LY8MCU,-1,The user has a strong interest in travel accessories and themed merchandise related to Dr. Who.,1,men's T-shirt with a fun travel theme,-2.975252,22.7,497014,Do you have any suggestions for a men's T-shirt with a fun travel theme?
B00KB465EA,Momo Baby First Walker/Toddler Thomas Leather Sandals,Baby | Sandals | Shoes | Baby Boys,I'm after a sandals that works best for beach outings for my baby boy.,A1Y63G2CFG20FR,B00D6BAQU4|B00DQ4KLZ6|B00CE3J6FQ,0,"The user has a preference for coordinated clothing sets, particularly those that include pants.",1,sandals for beach outings for baby boy,-10.195962,,6755,I'm after a sandals that works best for beach outings and casual gatherings for my baby boy.
B00GMIQG34,"Miusol Contrast Mesh With Polka Dot Long Sleeves Pencil Elegant Dress,US Size 4-14",Night Out & Cocktail | Dresses | Women | Clothing,What would be the best dress for upscale dining?,A1YH6H247UFLNN,B00F92YDCA|B00BM82UCK|B009A4Y08K,0,The user has a preference for clothing suitable for night out and cocktail events.,1,dress for upscale dining,-10.195835,,188417,What would be the best dress for upscale dining and social gatherings?
B00AR94GR2,Baby Togs Boys 2-7 Polo Set,Clothing Sets | Boys | Short Sets | Clothing,I'm after a boys' clothing set that works best for family gatherings during the summer.,A1UD8NT9NVQD8W,B004FVKI5C|B006Z5TU46|B00B4B07O8,0,"The user shows a preference for practical and functional items, such as backpacks and casual daypacks, which suggests an interest in products that are suitable for everyday use and travel.",-1,,-4.066244,14,397824,I'm after a boys' clothing set that works best for family gatherings and casual outings during the summer.
B008LDLT44,Saucony Women's Curve Crusader Bra,"Women | Intimates | Bras | Clothing | Lingerie, Sleep & Lounge | Sports Bras",Could you recommend a women's bra that makes me feel attractive and is suitable for everyday wear? I'm not sure about the specific wearing scene.,A200KEYARHXN36,B00BZHZ30Y|B00GYUKHGW|B000W41AIK|B00EQ21PI4|B009U4MC44|B00AEBW5F8|B00BZV2XJE|B008OQSYM8|B008KG36CA|B00AXYABS4|B0059817JQ|B004MXT9Z8|B0072NLS9U|B004YA83CY|B004BUI1I8|B002LIIYDY|B001JT7I24|B004QLOG0O|B006UDIEZE|B0087CVT8A|B004RKOF2I|B0090OQDLC|B005T46DNU|B008Q5SWQU|B005EVZ01O|B006SCSOOS|B0063EDQFI|B006QJY6RM|B007KDKE0Q|B006RX8BG4|B005JAFUZG|B00466IAZG|B0007RTBY2|B000E3C39O,3,"The user shows a unique interest in character-themed apparel, such as those featuring Harley Quinn and Jason Mask. They also favor items with distinctive patterns or designs, like chevron prints and tie-dye.",-1,,-10.192389,,10271,Please suggest a women's bra for feeling attractive and enhancing mood that can also be worn for everyday outings.
B000XDDERK,TOMS Women's Canvas Slip-On,Women | Men,Could you recommend a pair of women's slip-on shoes that are stylish and comfortable?,A1A7COL82T761O,B007YJRIYG|B00A02H5Z6|B009ZIR13W,-1,"The user shows a preference for stylish and trendy headwear, such as fedoras, and has an interest in floral patterns for children's clothing.",1,women's slip-on shoes that are stylish and comfortable,-10.192983,,3,Could you recommend a pair of women's slip-on shoes that are stylish and comfortable for everyday wear?
B00DEYQYAY,"London Fog Women's Long Down, Black, Medium",Women | Clothing | L | Down & Down Alternative | Coats & Jackets | London Fog,I'm looking for a women's down coat that will keep me warm during outdoor events while still looking stylish. I'm not sure about the specific wearing scene.,A3QIGW65DAKU5V,B00CYS2T8M|B009S3I7EG|B007MNVB7E|B00FFYTF8Y|B005VEN6VU,3,"The user shows a unique preference for newsboy caps and berets, indicating a taste for classic and chic headwear styles.",-1,,-4.8620496,,334974,I'm interested in a women's down coat that can help me stay warm during outdoor events while still looking stylish for social gatherings.
B007IO7ZHC,Mootsies Tootsies Women's Ideal Pump,M | Women | Shoes | Pumps | Mootsies Tootsies,What are some good pump options for a formal event? I'm not sure about the specific wearing scene.,A2FWUDRDKMSF93,B00DBVBTYQ|B006BU7UGA|B00B2G3VHK|B006J8LVG4,3,"The user shows a preference for water-resistant and waterproof features in their clothing and footwear, indicating a need for practicality and durability in their purchases.",-1,,-8.789945,,28975,What are the best pumps options for attending a formal event and ensuring comfort during travel?
B00ETHNGII,Volcom Juniors Moclov P O Hoodie,"Women | Band & Music Fan | Clothing | Juniors | Novelty, Costumes & More | Sweatshirts | Fashion Hoodies & Sweatshirts",Could you suggest a juniors' set of clothes for layering during outdoor runs in cooler weather?,AQLMI1SR6CHQV,B00CBTD3GQ|B00877NA5K|B0091F7W6K,1,The user shows a preference for vibrant and neon colors in their athletic wear.,-1,,-6.427926,,151178,Could you suggest a juniors' hoodie that fits my need for layering during outdoor runs in cooler weather?
B0037Z6B8K,New Balance Men's MR759 Running Shoe,N | Shoes | New Balance | Athletic | Running | Men,I’m searching for a set of clothes for men that are suitable for outdoor adventures in larger sizes.,A3GI4OF0DGDOL4,B001C7P8PW|B000EQVXGK|B0006U67WE,1,"The user shows a preference for products associated with athletic activities and possibly has an interest in unique or less common styles, as indicated by the keyword 'Exotic Apparel.'",-1,,-0.6684817,69.99,68394,I’m searching for a men's athletic running shoes that are suitable for outdoor adventures and casual outings in larger sizes.
B00DQ5P9Y8,FootJoy 2014 Contour Series A-Frame Golf Shoes,Athletic | Golf | Shoes | Men,Can you recommend me a men's shoes for golf-related activities?,A1CUHIMHGOARSW,B00AAH9JNM|B00H0EQ1AC|B00BPVV2ZU|B0083RNFFO,0,"The user shows a preference for brands like Reef and True Religion, indicating a taste for stylish and possibly premium casual wear.",1,men's shoes for golf-related activities,-0.65290606,,86070,Can you recommend me a men's shoes for casual outings and golf-related activities?
B003JJ5AUE,Merrell Men's Encore Gust,M | Shoes | Merrell | Men | Mules & Clogs,I’m looking for men's mules that are good for casual outings during the summer. I'm not sure about the specific wearing scene.,A1VCOX6I94JLZV,B00F3WD0E8|B009KYJAJY|B000B84URK|B002KKCVPU|B005G112A0|B001B6EG3E,3,"The user shows a preference for outdoor and casual footwear, as indicated by the purchase of hiking shoes and sandals.",-1,,-1.1513957,,1877,I’m searching for men's mules that are suitable for casual outings and easy to slip on for a summer event.
B00F2V77JE,Sakkas Women's Soft Fleece Lined High Waist Leggings,Women | Leggings | Clothing,Please suggest a leggings for a yoga class that allows for easy movement.,A17K37JYKM6VXE,B003VKPI6W|B003MNEZNA|B00684UKK2|B0036FSXI2|B0058LTW2S|B0017GQRDA,0,"The user has a strong interest in costumes, particularly those with a novelty or themed aspect, such as nautical or retro styles.",1,leggings for a yoga class that allows for easy movement,-10.193625,,9159,Please suggest a leggings for a yoga class that allows for easy movement and flexibility.
B001W7DBNS,REEBOK F/S Hi Geo Floral Orange Shoes Womens Size 9.5,Women | Shoes | R | Fashion Sneakers | Reebok,I'm searching for women's sneakers that are practical and comfortable.,A2DKLZOG6EOQSM,B001LNJUMO|B00FKG87MW|B00C2SVU4I|B00EDVW7RG|B0001ZNZJM|B00284ADP8|B001AQFH3I|B005Y2K9C8|B005QR8VE4|B003JJD3T4|B005QR8VV2,-1,"The user has a specific interest in button-down shirts and leather shoes, indicating a preference for classic and versatile wardrobe pieces.",1,women's sneakers that are practical and comfortable,-9.368694,,259135,I’m searching for women's sneakers that are practical and comfortable for everyday wear.
B0098LULEW,"Champion Men's 1919 Raglan Crew, Navy, XX-Large",Clothing | Active | Active Sweatshirts | Men | Sweatshirts | Sports & Outdoors,What would be the best men's active sweatshirt for layering? I'm not sure about the specific wearing scene.,A27EAOSSB3NJDF,B001A1RW90|B008HM3EWY|B002ITIG5W|B003U9N2JO|B000KPN35E,3,"The user shows a strong preference for eco-friendly materials and sustainable fashion brands. They also favor bold colors and patterns, indicating a taste for vibrant and expressive styles.",-1,,-3.602529,,294320,What would be the best men's active sweatshirt for layering during outdoor adventures in unpredictable weather?
B00D502CM6,AxParis Women's Jewel Strap Backless Maxi,Dresses | Women | Clothing | Special Occasion,I'm looking for a women's dress that is fashionable.,A2VGZGUNW0MNP7,B00DXWDJT6|B00GT20DW8|B00EZCRSY0|B0072QTITO|B00GMTSNB6|B00DSPULAI|B00B4MQDKY|B00ESQLQ2I|B00F9BA5VO|B00CBVWHR0|B003EENBIM|B001XUQQNQ|B008KYX66I|B005SAHDVQ|B005E9GMIG|B009DI5L6I|B004T2K93S|B00AEZ9BQA|B0054TWX8O|B007AITYT8|B004H4WI3W|B005H3OJ0C|B008AIKAYU|B008SCJJEA|B001U5VGPW|B003M02TAE,-1,"The user has a strong preference for items with unique and eye-catching designs, such as sequins, rhinestones, and metallic elements. They also enjoy themed or character-based products, particularly those related to superheroes and popular media franchises.",1,women's dress that is fashionable,-10.193539,25,42028,I'm looking for a women's dress that is fashionable and perfect for a special occasion.
B00I469M4M,Ever Beauty Women's Sweetheart Airy Chiffon Beaded Bust Evening Dress,Women | Wedding | Clothing | Dresses | Bridesmaid Dresses | Special Occasion,I’d like to buy a set of clothes with the intention of wearing it to a formal gathering.,A1QFTO8GH32NK9,B00FL7AHMS|B007W2G7E2|B00F2SGB94|B00EW41B30|B001GBHPP0|B003XDTKCA|B001KYBBOO,1,"The user shows a particular interest in ASICS brand athletic shoes and has a preference for elegant, embellished gowns.",-1,,-10.1928005,,2238782,I’d like to buy a dress with the intention of wearing it to a formal gathering and possibly reusing it for other special events.
B003BSOMFM,Rabbit Skins Infant/Toddler Baseball Cap,Baby | Accessories | Hats & Caps | Baby Boys,I’m searching for a baby cap that’s suitable for outdoor activities and provides sun protection.,A1ADJVBAHUQ2MX,B00F51Z03G|B001867RIS|B008DS4TY4,0,The user has a strong preference for comfort-oriented shoes and travel-friendly products.,1,baby cap that’s suitable for outdoor activities and provides sun protection,-3.9094183,,17564,I’m searching for a baby cap that’s suitable for outdoor activities and provides sun protection.
B009612P02,LIBERTY BLACK Fringe Vegas Faggio Womens Boot,Women | Shoes | Fashion | Boot Shop | Western | Boots,Can you recommend me some women's boots? I'm not sure about the specific wearing scene.,A32OSUBY2RLFVV,B007SIG5LK|B00CHGQWPM|B00BPW5ELM|B00BQ0TI1U|B004NNF2MQ|B0030L46QU|B002WJ57MI|B008YJMDTA|B000E9ZR6Y|B002N3AWH8|B0053O1KJ8|B004WFW0SE|B002D2Z4GI,3,"The user has a distinct preference for steampunk and flapper styles, as well as themed accessories like ties and patches. There is also a notable interest in holiday-themed items, particularly related to St. Patrick's Day.",-1,,-10.196748,,177323,Can you recommend me some women's boots for attending outdoor concerts and cultural events?
B000V56JZO,Smartwool Men's Diamond Jim Sock,Socks | Clothing | Men | Casual Socks,I'd like to find men's casual socks that are suitable for sports and outdoor activities.,A3R1L6SU0HW1V6,B00CE1FJP4|B001T9NVXO|B000T9VK56|B0091GVYAO|B005J36C1Y|B00A77VE6K|B002J9H4JU,-1,The user shows a particular interest in trail running and performance-oriented footwear.,1,men's casual socks suitable for sports and outdoor activities,0.47626242,,97906,I'd like to find men's casual socks that are suitable for sports and outdoor activities.
B006WWQY28,Ever Pretty Ruffle Bust Spaghetti Straps Elastic Formal Maxi Dress 09350,Dresses | Women | Clothing | Special Occasion,I want to find a women's dress that fits a modest style.,A3S7EFA0N0QWRW,B001I0H6XK|B005KCAJG8|B00BSUFVFK|B00BJH1D7C,-1,"The user has a strong interest in novelty and themed costumes, particularly those that are deluxe or have a unique character theme.",1,women's dress that fits a modest style,-10.196142,,312072,I want to find a women's dress that is suitable for a special occasion and fits a modest style.
B00HA34H3G,Van Heusen Men's Short Sleeve Mini Plaid Faux Linen Button Down,Casual Button-Down Shirts | Shirts | Clothing | Men,Can you recommend me a men's casual button-down shirt in larger sizes?,A2EJLCY3I38PA2,B007GNHSV8|B000HX5E42|B004GTMVGW|B004J4F6AW|B004VR9HP2,-1,The user has a strong preference for the Dockers brand and materials like cotton.,1,men's casual button-down shirt in larger sizes,-3.3522682,,27930,Can you recommend me a men's casual button-down shirt in larger sizes?
B00GT94FRU,niceeshop(TM) Fashion Women Flower Ink Style Soft Voile Chiffon Scarves Wrap,Accessories | Women | Scarves & Wraps | Fashion Scarves,I'm after a scarf that works best for adding a pop of color for casual outings.,A3VHEASFGNI03M,B006SVSJHG|B007ZLU86S|B009WEDN90|B00ALPWCQE|B009S3U1UY|B007ZXYHHW,0,The user has a preference for gold watches.,1,scarf that works best for adding a pop of color for casual outings,-8.887218,3.59,980,I'm after a scarf that works best for adding a pop of color and layering outfits for casual outings.
B000NI2D68,Justin Boots Men's Farm and Ranch Boot,Shoes | Justin Boots | Men | J | Boots,I need a set of clothes for men that are perfect for outdoor adventures.,A3E2GTEX29WVBJ,B00G337AY2|B008AZ4GL6|B00GN813E0|B00G5IT4H6|B007YJ5LXQ|B007YVYP3G|B001PO5JBA|B0053XF2U2|B002AWE6G0|B0055QNCCC,1,"The user shows a strong interest in novelty and costume items, as well as unique fashion accessories like designer handbags and printed scarves.",-1,,-0.1736319,,16940,I need some men's boots that are perfect for outdoor adventures and stylish layering.
B0036ZDQ1Q,Noble Mount Oversized 'Arizzo' Handbag - Clearance,Women | Handbags & Wallets | Shoulder Bags,Can you show me a handbag that works for everyday use?,A35CBG3DNYGVXF,B009ZDEXQK|B009FS3PBY|B00ED4RJNA|B00DCZC0BW|B009Q77ROK|B009SZES5Q,0,The user has a strong preference for the brand Skechers and values comfort in their footwear choices.,1,handbag for everyday use,-8.0158825,34.99,33970,Can you show me a handbag that works for everyday use and special occasions?
B0049BLJJ2,"Lovely People Women's Alia Oxford,Black,7.5 M US",Women | Lovely People | Shoes | L,Can you suggest some women's boots that would be stylish and comfortable?,A11AVDPZQ4S0T1,B003UYMUE2|B002L1713U|B002ZG91GG|B003QCK13K|B002WV9BT6,-1,"The user shows a preference for stylish and possibly edgy footwear, as indicated by the keyword 'Motorcycle'.",1,women's boots,-10.192892,,393713,Can you suggest some women's boots that would be stylish and comfortable for everyday wear?
B00730VMCU,Ever Pretty Padded Ruffles Rhinestones Prom Gown Evening Dress 09503,Dresses | Women | Clothing | Special Occasion,Could you suggest a dress that fits my need for a formal event?,A35CCD0Z53AFK8,B000W0SY0Q|B0015ZI35I|B0016PKA1W|B000VWGBAA,0,"The user shows a preference for specific brands like Dyeables and Nine West, and has an interest in unique colors such as dark purple.",1,dress for a formal event,-10.087058,,165940,Could you suggest a dress that fits my need for a formal event and a milestone celebration?
B0015MGJFM,Sesame Street Elmo Face RED Men T-Shirt Medium,"Tops & Tees | T-Shirts | Men | Movie & TV Fan | Novelty, Costumes & More | Novelty",I’d like a set of clothes for men that’s great for themed gatherings.,A1RHM4JTUYXKSG,B000NF7ZTQ|B000HAYNO2|B002LNQQWK,1,"The user has a strong interest in novelty and themed clothing, particularly those related to comics and music. There is also a preference for unique footwear and costume-like apparel.",-1,,-1.9443346,,6797,I’d like a men's T-shirt that’s great for themed gatherings and casual outings.
B007OXAJN4,Klogs USA Women's Lindsay Pump,Women | Shoes | K | Pumps | Klogs,I’m looking for pumps that would work for formal events. I'm not sure about the specific wearing scene.,A2W2MFKM0DSJZE,B007CKVO06|B000GBUQMU|B007OQOKU4,3,"The user has a strong preference for comfort-oriented shoes, specifically those that are stylish yet practical, such as Mary Jane pumps and wool clogs.",-1,,-0.64710665,,54944,I’m in need of a pumps that are suitable for attending formal gatherings and casual outings.
B00FEVHZEO,Sakkas Spike Studded Knit Slouch Fashion Beret,Accessories | Berets | Women | Hats & Caps,Can you suggest a women's hat that will help with making a fashion statement?,AEW631YU5KIXO,B009SOXU5Q|B000YC3LVY|B000W8Z6MW,0,"The user shows a preference for specific brands such as Penny Loves Kenny and Steve Madden, and has an interest in unique styles like leopard print.",1,women's hat that will help with making a fashion statement,-10.194933,16.99,524818,Can you suggest a women's hat that will help with making a fashion statement at a casual outing?
B008H2ET0U,"Hanes Men's 10 Pack Crew Sock, White, 10-13 (Shoe size 6-12)",Clothing | Athletic Socks | Active | Socks | Men | Sports & Outdoors,Do you have men's athletic socks?,A2TMX22A2LOGUX,B00609P9CY|B0045OWFZ0|B000UU1WUW,-1,"The user has a preference for wool and blend materials, as well as a liking for studded designs.",1,men's athletic socks,2.4435349,,26068,Do you have men's athletic socks for sports and outdoor activities?
B00FE182XC,Three Stooges T-Shirt Sublimation We Want Our Mummy,"T-Shirts | Tops & Tees | Men | Movie & TV Fan | Novelty, Costumes & More","What would you recommend for a men's T-shirt that features novelty designs from movies and TV shows, as I'm looking for something stylish?",A2DKMD285D7J8I,B004RHNTDW|B00I1WXMX6|B002RASIHS,-1,"The user shows a strong interest in eco-friendly materials and vibrant colors, suggesting a preference for sustainable fashion with a bold aesthetic.",1,men's T-shirt that features novelty designs from movies and TV shows,-6.01312,,591105,"What would you recommend for a men's T-shirt that features novelty designs from movies and TV shows, as I'm looking for something stylish for my partner?"
B004GC4PH2,ASICS Men's Team Storm Shelter Jacket,Track & Active Jackets | Active | Clothing | Men,I want a men's active track jacket that is suitable for both athletic and casual wear.,A1RHJJMF5KQMUE,B0032ANQR4|B002KAO0EU|B0016OGWLA,-1,"The user shows a preference for brands like Columbia and Nine West, indicating a taste for both outdoor and stylish footwear.",1,men's active track jacket,-2.0335367,,164293,I want a men's active track jacket that is suitable for both athletic and casual wear.
B00CABJ20G,Sandal King Women's EVA Flip Flops,Sandals | Women | Shoes,I’m in need of women's sandals that are comfortable and stylish.,A3H82NXGLHXDEU,B0089E3YTS|B002RS6HCS|B000RRG5YG,-1,"The user shows a preference for stylish and versatile clothing items, such as cardigans and tank tops, as well as comfortable footwear like flip flops.",1,women's sandals that are comfortable and stylish,-9.995965,5.44,5407,I’m in need of women's sandals that are comfortable for everyday wear and stylish for summer outings.
B0074V6V92,Trotters Women's Paulina Pump,Women | Shoes | Pumps | Trotters | T,"I'm looking for a pump that’s suitable for formal events but also versatile enough for casual outings. Additionally, could you recommend a stylish dress and a pair of tights to complement these shoes?",A2UGCOJ5PZ5OQR,B00BI1WSZK|B00EUUNAV2|B0016BR8KM|B007JXOY2G,2,"The user shows a preference for winter accessories, such as faux fur ski hats and cowlneck scarves.",3,pump|stylish dress|pair of tights,-3.7321146,,2109,I need something like a pump that’s suitable for attending formal events and also versatile enough for casual outings.
B00877N866,ASICS Women's GEL-Noosa Tri 8 Running Shoe,Women | Shoes | Athletic | ASICS | Running,I want a women's athletic running shoe that is comfortable.,A1EC9T4T5PYXOB,B005LVA16Q|B007W2G7E2|B00AK8O20G,-1,"The user shows a strong preference for high-performance running shoes and breathable, comfortable shirts suitable for active lifestyles.",1,women's athletic running shoe that is comfortable,-10.196598,,1890,I want a women's athletic running shoe that is comfortable and suitable for long-distance running.
