id,title,category,new_query,user_id,remaining_interaction_string,classification,preferences,target_count,targets,similarity_score,price,ranking,query
B0016BH0YQ,"EMU Australia Women's Bronte Lo Boot,Chestnut,8 M US",Shearling | E | Boot Shop | Women | EMU Australia | Shoes | Boots | Fashion,Can you recommend a women's boot for outdoor use in cold climates? I'm not sure about the specific wearing scene.,A5KK0J517PP7E,B000JQEHMC|B002FKQ5OS|B002F1W5A0|B001A6OIR4|B000J36PFW|B002C7O2OY,3,"The user shows a strong preference for brands like Bearpaw and styles that include shearling and faux fur, suggesting a liking for cozy and stylish winter footwear.",-1,,-6.8987665,,65814,Can you recommend a women's boot that will work for outdoor activities in cold climates?
B005JSF0QW,Sugarlips Seamless Dress Cami,Dresses | Women | Casual | Clothing,Could you guide me to a dress that is best suited for a summer gathering?,A32OSZTF79PPB2,B00AJJIGGM|B003V859MM|B006VYHBZ6|B0093Y0144|B007TXABCS|B0058Z0DG8|B001AOEIVW,0,"The user has a notable interest in the brand SOREL, indicating a preference for this brand's style or quality.",1,dress best suited for a summer gathering,-10.196543,18.99,7217,Could you guide me to a dress that is best suited for a summer family gathering?
B00FY7VAQM,82 Days Women's Ponte Roma From Office Wear To Below Knee Pencil Skirt,Women | Clothing | Casual | Wear to Work | Skirts,"I need a skirt that’s suitable for professional events, but I'm not sure about the specific wearing scene.",A3QIFFME3F36SR,B00F8A8PAY|B00420Q6IE|B00EB0ZXHK|B0083S18LQ|B00D465V42|B008U7KRBM|B00169OAKK,3,"The user has a preference for themed or character-based clothing, as indicated by the purchase of a Rapunzel dress-up pajama gown and a pirate costume. They also show an interest in comfortable and versatile clothing items, such as skinny jeans and loose tunic blouses.",-1,,-3.3356562,,318,I need a skirt that’s perfect for professional events and casual outings.
B00IT9C6EC,82 Days Women'S Rayon Span Regular To Plus Basic Maxi Skirt - Solid,Women | Casual | Skirts | Clothing,Could you recommend a skirt that fits my need for versatile styling during casual outings?,A3ABHXZARMHREX,B00372EREI|B00BQQQ7YU|B00DY3XOSU|B009OC6T14|B009RUQWX8|B004JLXNVO|B00BTWJXZQ|B0073ARU5I|B008N6UUZ8|B001OCMA06,0,"The user shows a preference for stylish and trendy items, such as sunglasses, swing dresses, and infinity scarves. They also favor comfortable yet fashionable footwear and clothing, as seen in their choice of boots and cardigans.",1,skirt,-9.501754,,2759,Could you recommend a skirt that fits my need for versatile styling during casual outings and cultural events?
B008W1AD2Y,4-rth Fusion Gym Short,Clothing | Active | Active Shorts | Men | Sports & Outdoors,I want a set of clothes for men that are suitable for outdoor activities.,A2CN7XE4C2E6HT,B008FZN3T2|B000TGPTRO|B00BCKZWDC,1,"The user has a preference for active and yoga-related clothing, suggesting an interest in fitness or a lifestyle that values comfort and flexibility.",-1,,1.558952,34,13229,I want a men's shorts that are suitable for outdoor activities and versatile enough for casual outings.
B0088AR09S,N Natori Women's Nirvana Robe,"Women | Clothing | Sleep & Lounge | Lingerie, Sleep & Lounge | Robes","I'm looking for a robe that suits my needs for relaxing at home, but I'm not sure about the specific wearing scene.",A3S7CS1TXSZH7O,B0006MY4EU|B004JN083I|B000K2TJQO,3,"The user shows a preference for warm, cozy, and easy-to-wear footwear, as indicated by the interest in slippers and cold weather boots.",-1,,-10.047159,,11233,I want a robe that can meet my needs for relaxing at home and participating in family gatherings.
B008EY6VSO,Juniors I Mustache You a Question But I'll Shave It For Later Novelty T-Shirt,"Clothing | Tops & Tees | T-Shirts | Novelty, Costumes & More | Novelty | Girls",I am looking for a girls' novelty T-shirt that is comfortable and functional.,AYHEBBDFP8O52,B008G29BWW|B004U4ROXI|B008R87WLM,-1,"The user shows a preference for no-show and liner socks, as well as skate shoes, indicating an interest in casual and sporty styles.",1,girls' novelty T-shirt,-10.18734,,317086,I am looking for a girls' novelty T-shirt that is comfortable and functional for everyday wear.
B004LKVJN2,Bostonian Men's Wendell Oxford,Men | Bostonian | B | Shoes | Oxfords,I'd like to find a men's oxford shoe that is comfortable.,A200KUK6GTIRUR,B008XMI6AS|B007A77PRW|B007ULX0FO|B004OXJD5M|B001TK2EXQ,-1,"The user shows a strong preference for Skechers brand shoes, particularly those with memory foam for added comfort.",1,men's oxford shoe that is comfortable,-4.277761,,1961,I'd like to find a men's oxford shoe that is comfortable for everyday wear.
B00F8YP9XG,Momo Maternity &quot;Rose&quot; Channel Quilted Hooded Down Puffer Coat - Black M,Maternity | Women | Outerwear & Coats | Clothing,Could you recommend a women's coat that fits my need for stylish protection during outdoor events?,A3QSTVPK8V804K,B00BXQMT3G|B00AUCJQIA|B00BTCNNU2|B00CIA7FDU,0,The user shows a strong preference for specific brands such as Seychelles and Nine West.,1,women's coat,-7.374911,,535788,Could you recommend a women's coat that fits my need for stylish protection during outdoor events while accommodating my changing body size?
B00C6FHE24,WallFlower Juniors Seriously Straight Chino Pants,Casual | Juniors | Women | Clothing | Pants,Can you show me a juniors women's set of clothes that are suitable for casual gatherings?,A32OTJN1YZB6ZC,B00EO3B2T2|B0081KKPNI|B00E3W462O|B0038NWUKO|B000A1ADEW,1,"The user shows a strong interest in athletic and running gear, indicating a lifestyle that may include regular physical activity or sports.",-1,,-10.196319,16.99,28122,Can you show me a juniors women's pants that are suitable for relaxed outings and casual gatherings?
B00EKEISHE,Tifosi womens Rumor 1100300234 Shield Sunglasses,Women | Clothing | Tifosi | Accessories | Sunglasses & Eyewear Accessories | Sports Sunglasses | T | Sunglasses | Sports & Outdoors,Could you guide me to a women's sports sunglasses that are unique and stylish?,ADUR1LKXTKA7D,B0060GTKTK|B007F2XQ2K|B000XETXOC|B00ACKQ2OG|B003BS2WKO|B003299WUU,-1,"The user shows a strong interest in novelty and costume-related items, suggesting a preference for playful or themed fashion accessories.",1,women's sports sunglasses that are unique and stylish,-6.9903417,58.87,31075,Could you guide me to a women's sports sunglasses that are unique and stylish for outdoor activities?
B000W91BWU,Rocket Dog Women's Crush Platform Thong Sandal,Women | Shoes | Rocket Dog | R | Sandals | Summer Event,I'm looking for women's sandals that provide comfort and style.,A1ADJPU0HQSXCP,B00E4FU2X2|B00310ZV0A|B0071KR2SK,-1,"The user shows a preference for brands like Clarks and Ariat, indicating a taste for quality and possibly premium footwear.",1,women's sandals that provide comfort and style,-9.688818,,3547,I’m looking for women's sandals that provide comfort and style.
B00829SRKG,"Sofie Women's V Neck Long Sleeve Sweater, Black, XX-Large",Sweaters | Women | Pullovers | Clothing,I’m looking for a women's sweater that is suitable for casual outings and can be layered for warmth.,A2DKP9DVN1KI77,B007U5VFY8|B00APJIT5O|B000SZSUFO|B005DQGS8O|B009ZFCJGO|B009L7QVNI|B009L775DI,0,"The user has a strong preference for lounge and sleepwear, as indicated by the frequent purchase of lounge pants and slippers. They also show an interest in floral patterns and specific brand styles, such as those from Quiksilver and Tommy Bahama.",1,women's sweater suitable for casual outings and can be layered for warmth,-10.065332,,124615,I’m looking for a women's sweater that is suitable for casual outings and can be layered for warmth during transitional weather.
B00BENRMT4,Orthaheel Womens Sasha II Mule Clog,Loafers & Slip-Ons | Women | Shoes,Can you show me some women's loafers and slip-on shoes that are stylish and comfortable?,A2GWH4EAJEED2U,B00595941W|B006L0D60E|B004PGJIIK,-1,"The user shows a preference for brands like Vionic by Orthaheel, Sorel, and BEARPAW, indicating a possible interest in comfort and style.",2,women's loafers|slip-on shoes,-10.193068,,7950,Can you show me some women's loafers and slip-on shoes that are stylish and comfortable for everyday wear?
B005UVM368,PattyBoutik Cowl Neck Button Embellished Ruched Blouse Top,Tops & Tees | Women | Blouses & Button-Down Shirts | Clothing,Can you help me choose a blouse for a brunch gathering?,AZWCP38DUR612,B004AMETN8|B007JK4G4U|B00A8ATI3W|B008XOX6M4|B00CE5YX4S|B007GB19PQ|B003XKNC0E|B008ALO4EE|B00A6MZFH0|B00B1BXIOC|B0041OX2FG,0,"The user shows a strong preference for items that are described as sexy, fitted, and often include unique detailing such as ruching, twist knots, and bandages. They also prefer bold and edgy styles like punk-inspired or skull-themed designs, suggesting a taste for fashion that is daring and expressive.",1,blouse for a brunch gathering,-10.196868,35,3116,Can you help me choose a blouse for a brunch gathering and a smart-casual office setting?
B005W46H4W,Kamik Men's Greenbay4 Boot,Shoes | Snow & Cold Weather | K | Kamik | Outdoor & Work | Men | Boot Shop | Boots,Do you know any men's boots that would work well for outdoor activities in winter? I'm not sure about the specific wearing scene.,A2GWG8N5RJ7R9N,B000EDH9P2|B003OYISW6|B005CB59N0|B0007SZ578,3,"The user shows a strong interest in athletic and cross-training shoes, as well as a preference for winter promotions.",-1,,0.26680183,79.5,81727,Do you know any men's boots that would work well for outdoor activities in extreme temperatures and casual outings during winter?
B008VWZB9E,Aravon Women's Clarissa Fisherman Sandal,Women | Shoes | Sandals,Do you have any suggestions for women's sandals that I can wear during beach outings?,A2DKLO9R61CE6S,B001KS646U|B00BBT7X3G|B008NQNM4O,0,The user shows a preference for brands like La Canadienne and styles that are fashionable.,1,women's sandals,-10.196636,,5087,Do you have any suggestions for women's sandals that I can wear during beach outings and relaxed gatherings?
B00ENBDVO4,"O'Neill Boys 8-20 Curbside, Navy, Medium",Tops & Tees | Tees | Boys | Clothing,What’s the best boys' tees I can use for casual outings during summer camps?,A1CUGQWF9ENYOE,B00D2KMIMS|B0050855Y8|B003M2XQ0E|B006MWNBHO,0,"The user has a preference for branded clothing items, as seen with specific brands like Hurley, O'Neill, and Lee. They also seem to favor items with unique design elements, such as floral patterns or distinctive necklines.",1,boys' tees for casual outings during summer camps,-10.196709,,805016,What’s the best boys' tees I can use for casual outings during summer camps?
B000FRSOQU,"Gerber 5-Pack Variety Bodysuits Brand One Piece Underwear - Girl 2009, 18 Months",Baby | Bodysuits | Baby Girls | Clothing,Could you recommend a bodysuit that fits for family gatherings?,AXKCFGN6411MY,B0064AO1Y6|B00A81LCB2|B009A7CVEC|B0009JXXZ6|B00A7R7DVU|B002HFGGDG|B007PESQKA|B001UE74CM|B00138YJYQ|B0013I01JS|B002U0HJKW|B000820YBU|B002LLOLB0|B0023RSUWI|B0012S5TZK,0,"The user shows a preference for themed clothing, particularly those featuring characters or designs like Angry Birds and dinosaurs.",1,bodysuit that fits for family gatherings,-8.551596,,239454,Could you recommend a bodysuit that fits for family gatherings and playdates?
B006HKYZLC,Gold and Silver Formal Tie Bar Set,"Tie Clips | Jewelry | Men | Novelty, Costumes & More | Novelty",Can you show me a men's tie clip that works for adding a touch of style?,A1IS5SPI99GQXG,B004AURKIQ|B000ZL779G|B001QCN3H8,-1,"The user has a preference for performance-oriented and possibly unique or niche clothing items, such as toe socks and themed neckties.",1,men's tie clip,-3.542171,25,16568,Can you show me a men's tie clip that works for adding a touch of style to my activewear outfits?
B001188FZC,Lee Women's Relaxed Fit Straight Leg Jean,Petite | Women,I am looking for women's petite jeans that are comfortable and practical.,A2FWSBTIWSMJGJ,B008OOKJTG|B0024NCAZ4|B000UMDUHI|B005QNUHA4,-1,"The user has a unique interest in themed or character-based items, as indicated by the purchase of Yo Gabba Gabba clogs.",1,women's petite jeans that are comfortable and practical,-10.196765,,616,I am looking for women's petite jeans that are comfortable and practical.
B004BKIPHK,Vitalsox Graduated Compression Performance Patented Recovery Socks with Dry Stat,Big & Tall | Clothing | Running | Socks | Men | Exercise & Fitness | Sports & Outdoors,I want a men's big & tall running sock that is suitable for exercise and fitness.,A17K3J8H8TTUIV,B002H5G1RC|B001E5CR2Y|B000R4LFV2|B000R7C2WA|B005OEEH6U|B007IM6YA8|B004YHRAJO|B007M5U8OE,-1,"The user shows a unique preference for embroidered patches and tattoo art, indicating an interest in personalized or artistic expressions. There is also a notable interest in novelty and themed clothing items.",1,men's big & tall running sock,-3.8812182,,44,I want a men's big & tall running sock that is suitable for exercise and fitness in sports and outdoors.
B00E1CU2FG,"Request Girls 7-16 Straight Leg Jean with Flap Back Pocket, Zuma, 10",Jeans | Girls | Clothing,"I’m searching for girls' jeans that are casual, versatile, and youthful.",AQ14VJKC7NOLY,B009AFGXDY|B00HEOV89M|B00E1CTM2A|B00FQ17ZTM|B00HEGRWEK|B00CTS0QDW,-1,"The user shows a preference for bootcut and skinny jeans, as well as tops with unique necklines like slouch and round necks. The user also seems to favor clothing with specific design details, such as detailed flap back pockets.",1,"girls' jeans that are casual, versatile, and youthful",-10.173527,,259230,"I’m searching for girls' jeans that are casual, versatile, and suitable for a youthful style."
B00AO4HUDC,"U.S. Polo Assn. Men's Solid Pique Shirt, Engine Red, Medium",Polos | Shirts | Clothing | Men,I’m in need of a men's polo shirt that is suitable for family gatherings.,A2BJ3EU0MRTYRT,B0050SC4HE|B002WTC6DG|B000ML7OYW,0,"The user shows a preference for practical and comfortable clothing items, such as jeans and socks, and may have a need for durable footwear for children, as suggested by the purchase of rain boots for kids.",1,men's polo shirt suitable for family gatherings,-3.6790895,,52442,I’m in need of a men's polo shirt that is suitable for family gatherings and layering under blazers.
B004YA5X68,"Fahrenheit Women's Dora-01 Ankle-Strap Sandal,Light Blue Denim,6 M US",F | Fahrenheit | Shoes | Women | Sandals,Can you recommend me a women's sandals for a larger size that are stylish?,A2H2UAC83N65BK,B008XCMEM4|B007FA5ACG|B003VCRRSC|B000W2F1EQ|B000Q5WAOI|B001BYH6KG|B002WJUTXA,-1,"The user shows a strong interest in costumes, particularly those with a novelty or themed aspect, such as pirate or fantasy styles.",1,women's sandals for a larger size that are stylish,-10.194321,,222251,Can you recommend me a women's sandals for a larger size that are stylish and suitable for themed events?
B00KA7GIAY,Orino Beauty&trade;Women's Floral Bikini Swimwear Cover Up Beach Dress(blue),Women | Cover-Ups | Swimsuits & Cover Ups | Clothing,Please suggest a cover-up for sun protection during tropical vacations.,A29UM3FDZ4FY9P,B00KKBT1W2|B007VU1H2W|B003G5L0DM,0,The user shows a preference for items with unique design elements such as criss-cross patterns and shiny metallic finishes.,1,cover-up for sun protection during tropical vacations,-7.1994634,11.99,104998,Please suggest a cover-up for sun protection during tropical vacations.
B00767DITU,Tween Sally Costume,"Novelty, Costumes & More | Costumes & Accessories | Costumes",I'm after a costume that works best for a themed birthday celebration.,A1FHV5LCS3FMM6,B000XDDERK|B0013KBX5W|B006CZ2KK0,0,"The user shows a preference for travel accessories and packing organizers, indicating a focus on efficient packing and organization during travel.",1,costume for a themed birthday celebration,-6.5769877,,60296,I'm after a costume that works best for a themed birthday celebration while traveling.
B008HZYK2E,"Kensie Women's Flecked Color Block Tee, Heather Dark Berry Combo, X-Small",Tops & Tees | Women | Knits & Tees | Clothing,Can you point me to a knit tee that’s best for casual outings?,A2HFYRCWH4H3HQ,B007KHF4GQ|B0052OPAM2|B0052OP9PA,0,The user shows a strong preference for the Franco Sarto brand.,1,knit tee,-10.19595,,551388,Can you point me to a knit tee that’s best for casual outings while pairing well with boots?
B005JXJHGQ,Rhonda Shear Ahh Seamless Leisure Bra (9588),"Women | Intimates | Bras | Clothing | Everyday Bras | Lingerie, Sleep & Lounge",Could you suggest some women's sleepwear that I can wear during cozy evenings? I'm not sure about the specific wearing scene.,A3TSEW1ANGIOZN,B0012FQLBO|B001FWZ06Q|B005F5M2P6,3,"The user has a strong preference for clothing related to skiing and snow sports, indicating an interest in outdoor winter activities.",-1,,-10.194611,,7303,Could you suggest some women's sleepwear that I can wear during cozy evenings after a day of snow sports?
B001U89CDC,"Pour La Victoire Women's Irma Wedge Boot,Brown,5 M US",Women | Shoes | Pour La Victoire | P | Boots,Could you guide me to a set of clothes for women that are suitable for special occasions?,A2DKOEM8RP8CB1,B00188MQ5A|B001N45BT2|B002HIX26W|B001CWV6OE,1,"The user shows a preference for specific brands like Sperry Top-Sider and Skechers, and may favor casual and versatile footwear options for children.",-1,,-10.19637,,412493,Could you guide me to a women's wedge boots that are suitable for both casual outings and special occasions?
B008ET8X44,Pink Camouflage Travel Tote Bag with Coin Purse,Luggage | Travel Totes | Luggage & Travel Gear,I want a women's travel tote bag with a coin purse that can meet my need for casual and comfortable style.,ANRVNQX6094PI,B007UMDERM|B000NNBALC|B007UMD8UU,-1,The user has a preference for subdued colors and camo patterns in their clothing choices.,2,women's travel tote bag|coin purse,-10.194096,,637524,I want a women's travel tote bag with a coin purse that can meet my need for casual and comfortable style.
B00GJC5A44,Haggar Men's Expandable Waist No Iron Dark Denim Pleat Front Pant,Jeans | Clothing | Men,Can you help me choose a men's jeans for casual outings that accommodate a Big & Tall body shape?,A1FW20E4FAQVBN,B000Y89B94|B0009KN2BU|B000MXIMZK,0,"The user has a preference for clothing items that offer comfort and practicality, such as expandable waist pants and no-iron features.",1,men's jeans for casual outings that accommodate a Big & Tall body shape,-7.2302833,34.99,23780,Can you help me choose a men's jeans for casual outings that accommodate a Big & Tall body shape?
B00B5QVEGC,Mud Pie Baby-Girls Infant Chiffon Party Hat Clip,Baby | Accessories | Baby Girls | Hats & Caps,What would you recommend for a hat that is stylish and trendy for baby girls?,A1228MTDSQDQYI,B0049B3NX2|B0012Y4XRY|B000M4XWB8|B000LQN42Y|B000ETMN0M|B000KYZDXA|B000O7DTAW,-1,"The user shows a preference for items with a touch of luxury or boldness, as seen in choices like gold-colored footwear and multi-color or oversized bags.",1,hat that is stylish and trendy for baby girls,-10.193268,2.44,5423,What would you recommend for a hat that is stylish and trendy for baby girls?
B007N1BVKM,Dreamgirl Pretty and Peasant Ruffled Shirt Costume Accessory,"Exotic Apparel | Novelty, Costumes & More | Costumes & Accessories",Could you guide me to a women's costume accessory shirt that is best suited for a themed birthday party?,A3BI6TR0TRGS7,B00422M6EK|B0007SUEVA|B00362L1OI,0,"The user has a strong interest in music-related items, as indicated by the keyword 'Band & Music Fan.'",1,women's costume accessory shirt,-10.192703,,4125,Could you guide me to a women's costume accessory shirt that is best suited for a themed birthday party?
B009S3HEOU,Ever Pretty Ruched Bust Empire Waist Long Chiffon Bridesmaids Dress 09766,Dresses | Women | Clothing | Special Occasion,I’d like a dress that’s specifically designed for a milestone celebration.,A3GI49VPO87K26,B007PSHN7I|B00EK94MS8|B00EDK7BEQ|B00E1QMF66|B00178VOCW|B008JSZ9PQ|B000Y032V0|B005345D5K|B003JUGM4G|B0076FEM8S|B006ZU1K1M|B006NU5T3O|B00876FOKU|B003XCGZVU|B006NU73RO|B000YM6FL2|B006NU73TW,0,"The user shows a unique preference for items with decorative details such as crochet, macrame, and lace. There is also an interest in versatile clothing pieces like maxi dresses and functional yet stylish footwear.",1,dress specifically designed for a milestone celebration,-10.196539,,120269,I’d like a dress that’s specifically designed for a milestone celebration.
B008HHLUAM,Hanes Women's Bikini with ComfortSoft&reg; Waistband and No Panty Lines 3-Pack # EV42AS,"Women | Intimates | Clothing | Lingerie, Sleep & Lounge | Bikinis | Panties",Can you recommend a women's bikini panty that will work?,A2VRL7YXVBA5Q6,B00BPBMD8A|B009F6HNF0|B00BLPUDWS|B00BHSV8Z0|B00BLPUFJE,-1,"The user shows a preference for slip-on shoes and athletic socks, suggesting a lifestyle that values convenience and possibly an active routine.",1,women's bikini panty,-10.193167,,4952,Can you recommend a women's bikini panty that will work for sleep and lounge?
B00KM9NV0U,Flats with Rhinestone Heart,Shoes | Girls,Could you recommend some girls' flats that are suitable for a family gathering at the park?,AYHFE4IKP03LS,B002JIO8V8|B006UMTOF4|B002NU6F7M,0,"The user has a preference for durable and versatile products that can be used in various weather conditions, as indicated by the purchase of a wetsuit and an umbrella.",1,girls' flats suitable for a family gathering at the park,-10.193367,22.99,3713,Could you recommend some girls' flats that are suitable for a family gathering at the park?
B00KSFT61G,FUSAI Men's Stone Wash Cargo Shorts Military,Cargo | Shorts | Clothing | Men,Please suggest a men's cargo shorts for outdoor adventures.,A1B85C05IX13A6,B00DP368HI|B00JVBWDI6|B00K1J57O4|B00CX9EEUI|B00HJBUFMQ|B007N3GQIM|B00FH200BU|B00G3NICFS|B00GS9PNWM|B00DQA3UTY|B00F2OSJIO|B00CTWBJOS|B00ASUZ5GQ|B003TLO300|B00DD0Q8B4|B00AUW5CEC|B00CQB09ZC|B00BFETJ70|B007YYYSBC|B009KR5ZL8|B00CMCBIP0|B00COTYPBU|B00AM392S6|B007P62EYM|B007B8CY8K|B00BFX7O4G|B008JGM4X8|B004IJXYRU|B008E5LV10|B006QGG2TU|B00AAZNW6O|B005TGKBTA|B004K6UM76|B004K061CC|B003C1QBOI|B003TLO34Q|B005407SEW|B004Y4C3N0|B0091KZVI6|B0036TGAR4|B005KQUMZW|B002CN7YKW|B007F2PWJ0|B002FRNAXU|B006MXNOMK,0,"The user shows a strong interest in brands like Lacoste, True Religion, and Ed Hardy, indicating a preference for designer and branded apparel. They also seem to favor unique and bold fashion statements, such as graphic tees with humor or political messages.",1,men's cargo shorts for outdoor adventures,1.3868121,24.99,57818,Please suggest a men's cargo shorts for outdoor adventures and casual summer gatherings.
B006H1T3SQ,Bates Men's Escalante Waterproof Motorcycle Boot,"Bates | Shoes | Work Wear & Uniforms | Outdoor & Work | Industrial & Construction | B | Men | Novelty, Costumes & More | Boot Shop | Work & Safety",Can you show me a men's boot that works for outdoor activities and rugged environments while also being suitable for semi-formal gatherings?,A3R1MHOSYWSQAD,B004X6ST46|B002NGKZ5E|B000977V4W,4,The user shows a strong preference for the brand Kenneth Cole New York and materials like wool blends.,1,men's boot that works for outdoor activities and rugged environments while also being suitable for semi-formal gatherings,2.8663895,,13863,Can you show me a men's boot that works for outdoor activities and rugged environments while also being suitable for semi-formal gatherings?
B00GTMGLF6,Sbicca Women's Delaluna Wedge Sandal,Sbicca | Women | Shoes | S | Sandals | Made in USA,Help me find women's sandals that are comfortable and supportive.,A2BPVPHCDERJP1,B00F31V33E|B0077I2OBQ|B003YJBYIQ|B008H2ET0U|B003V5Y1CY|B00827ROPW|B000CO86KK,-1,"The user shows a strong interest in hosiery and shaping garments, suggesting a preference for products that offer both style and support.",1,women's sandals that are comfortable and supportive,-10.157621,,27338,Help me find women's sandals that are comfortable and supportive.
B00J4WT2EA,Wet Seal Women's Embroidered Tiered Tank L Natural,Women | Clothing | Tops & Tees | Juniors | Tanks & Camis,Can you suggest a women's tank top that is casual and stylish?,A347TRZM5ZQQBW,B00I2U1RJS|B00G54JCQI|B00J4W0QM2|B00I0NTH9E,-1,The user shows a strong preference for floral patterns and lace details in their clothing choices.,1,women's tank top that is casual and stylish,-10.192757,,777038,Can you suggest a women's tank top that is casual and stylish?
B008KK0ZJ8,Clarks Women's Breeze Sea Flip Flop,Clarks | Women | Shoes | C | Sandals,I need women's sandals that are comfortable and stylish.,A1Z3QRLG18NEST,B0000A504H|B0072UQCCG|B004H76U6U,-1,"The user shows a preference for athletic shoes with a focus on specific brands like K-Swiss and Pelé Sports, and is interested in vibrant color combinations such as black and neon yellow.",1,women's sandals that are comfortable and stylish,-10.194641,,18,I need women's sandals that are comfortable and stylish for summer outings with my kids.
B0041KZOP6,Lacy Microfiber Knit Pocket Bra #769,"Everyday Bras | Women | Bras | Lingerie, Sleep & Lounge | Clothing | Intimates",Please suggest a set of clothes for intimate moments that is suitable for post-mastectomy needs.,AP2MURUT7QCAR,B00EOA8SK6|B0072B8016|B00EKV0BYK|B00DQJI4RS|B00474RYFO|B0002MB8DY|B001AEWOOK|B000BB3PFU|B005DF2X66|B0006JAMLM|B005MZIMHQ|B0008172S4|B000J4KK8O|B000FAJFG0|B000Y89B94|B001F0QNGO,1,"The user shows a preference for embroidered and tie-dye designs, as well as expandable waist features in pants, suggesting a desire for both style and comfort.",-1,,-10.195053,27.95,29198,Please suggest a lingerie set for intimate moments that provides a confidence boost and is suitable for post-mastectomy needs.
